{
  "$schema": ".app/app.schema.json",
  "title": "Eleventy Notes",
  "description": "A simple, lightweight, and flexible note-taking template for Eleventy.",
  "editThisNote": {
    "url": "https://github.com/rothsandro/eleventy-notes/edit/{{branch}}/{{file}}"
  },
  "sidebar": {
    "links": [
      {
        "url": "https://github.com/rothsandro/eleventy-notes",
        "label": "GitHub / Support",
        "icon": "github"
      }
    ],
    "notes": [
      {
        "pattern": "^/[^/]+$",
        "label": ""
      },
      {
        "pattern": "^/Releases/",
        "label": "Releases"
      },
      {
        "pattern": "^/Features/",
        "label": "Features",
        "tree": {
          "replace": {
            "^/Features": ""
          }
        }
      },
      {
        "pattern": "^/Deployment/",
        "label": "Deployment"
      }
    ]
  }
}
